{
  "schemaVersion": "1.0.0",
  "id": "de-a1-lesson-daily-routine-day-review",
  "languageId": "de",
  "level": "A1",
  "unitRef": "de-a1-unit-daily-routine-work-school",
  "titleFa": "یک روز معمولی را دنبال کن",
  "learningTargets": [
    "چهار بخش روز را به کار روزمرهٔ درست وصل کند.",
    "روتین مدرسه را از کار و غذا تشخیص دهد.",
    "به پرسش دربارهٔ بعدازظهر پاسخ مناسب بدهد."
  ],
  "sourceRefs": [
    "src-wikibooks-de-lesson-022-daily-routine"
  ],
  "lexemeRefs": [],
  "grammarNoteRefs": [],
  "activityDesign": {
    "activitySelectionRationale": "درس جمع‌بندی واحد، مسیر کار و مدرسه را در چارچوب چهار بخش روز دوباره به هم وصل می‌کند.",
    "sequenceRationale": "از مکالمه به نمای کامل روز و سپس پاسخ متناسب با یک بخش مشخص زمان حرکت می‌کند.",
    "templateSignature": "conversation_speaking>matching>choose_response"
  },
  "activities": [
    {
      "id": "act-de-a1-daily-review-conversation",
      "type": "conversation_speaking",
      "instructionFa": "روتین صبح و پیش از ظهر را دوباره اجرا کن و ترتیب روز را نگه دار.",
      "selectionReason": "گفت‌وگوی منبع‌دار چهارچوب زمانی روز را برای مرور فعال می‌کند.",
      "sourceRefs": [
        "src-wikibooks-de-lesson-022-daily-routine"
      ],
      "learningTargets": [
        "روتین صبح و پیش از ظهر را در گفت‌وگو بازیابی کند."
      ],
      "lexemeRefs": [],
      "dialogueRef": "dlg-de-a1-daily-routine-work",
      "data": {
        "interaction": "read_aloud_exchange",
        "openingInitiator": "app"
      },
      "transformations": [
        "verbatim_dialogue",
        "persian_translation_added",
        "character_metadata_added"
      ],
      "audioStatus": "not_required"
    },
    {
      "id": "act-de-a1-daily-review-matching",
      "type": "matching",
      "instructionFa": "هر جمله را به بخش درست روز وصل کن.",
      "selectionReason": "چهار پاسخ منبع‌دار نمای کامل صبح تا بعدازظهر را می‌سازند.",
      "sourceRefs": [
        "src-wikibooks-de-lesson-022-daily-routine"
      ],
      "learningTargets": [
        "چهار بخش روز را به کارهای مربوط وصل کند."
      ],
      "lexemeRefs": [],
      "dialogueRef": null,
      "data": {
        "pairs": [
          {
            "left": "Morgens trinke ich Kaffee.",
            "leftFa": "صبح‌ها قهوه می‌نوشم.",
            "right": "صبح",
            "rightFa": "صبح"
          },
          {
            "left": "Vormittags arbeite ich im Betrieb.",
            "leftFa": "پیش از ظهرها در محل کار کار می‌کنم.",
            "right": "پیش از ظهر",
            "rightFa": "پیش از ظهر"
          },
          {
            "left": "Mittags esse ich in einem Restaurant.",
            "leftFa": "ظهرها در یک رستوران غذا می‌خورم.",
            "right": "ظهر",
            "rightFa": "ظهر"
          },
          {
            "left": "Nachmittags gehe ich nach Hause.",
            "leftFa": "بعدازظهرها به خانه می‌روم.",
            "right": "بعدازظهر",
            "rightFa": "بعدازظهر"
          }
        ]
      },
      "transformations": [
        "source_items_grouped_for_matching",
        "persian_translation_added"
      ],
      "audioStatus": "not_required"
    },
    {
      "id": "act-de-a1-daily-review-response",
      "type": "choose_response",
      "instructionFa": "برای پرسش بعدازظهر پاسخ مناسب را انتخاب کن.",
      "selectionReason": "پاسخ‌های منبع‌دار نشان می‌دهند زبان‌آموز باید بخش درست روز را به پرسش وصل کند.",
      "sourceRefs": [
        "src-wikibooks-de-lesson-022-daily-routine"
      ],
      "learningTargets": [
        "به پرسش دربارهٔ بعدازظهر پاسخ مناسب بدهد."
      ],
      "lexemeRefs": [],
      "dialogueRef": null,
      "data": {
        "promptTarget": "Was machen Sie nachmittags?",
        "promptFa": "بعدازظهرها چه کار می‌کنید؟",
        "options": [
          {
            "textTarget": "Nachmittags gehe ich nach Hause.",
            "translationFa": "بعدازظهرها به خانه می‌روم.",
            "correct": true
          },
          {
            "textTarget": "Morgens trinke ich Kaffee.",
            "translationFa": "صبح‌ها قهوه می‌نوشم.",
            "correct": false
          },
          {
            "textTarget": "Mittags esse ich in einem Restaurant.",
            "translationFa": "ظهرها در یک رستوران غذا می‌خورم.",
            "correct": false
          }
        ]
      },
      "transformations": [
        "options_selected_from_source_material",
        "persian_translation_added"
      ],
      "audioStatus": "not_required"
    }
  ],
  "status": "final",
  "audioStatus": "pending"
}
