{
  "schemaVersion": "1.0.0",
  "id": "de-a1-lesson-time-plans-review",
  "languageId": "de",
  "level": "A1",
  "unitRef": "de-a1-unit-time-plans-appointment",
  "titleFa": "این ساعت نمی‌شه؛ ساعت دیگه چطور؟",
  "learningTargets": [
    "یک زمان دقیق را مؤدبانه رد کند.",
    "زمان و محل جایگزین را در پیشنهاد بفهمد.",
    "مناسب‌بودن زمان پیشنهادی را تأیید کند."
  ],
  "sourceRefs": [
    "src-wikibooks-de-lesson-021-time-appointment"
  ],
  "lexemeRefs": [],
  "grammarNoteRefs": [],
  "activityDesign": {
    "activitySelectionRationale": "دو درس قبلی بازهٔ برنامه و دعوت را پوشش می‌دهند؛ این درس مذاکرهٔ واقعی روی ساعت دقیق و تأیید زمان/محل را اضافه می‌کند.",
    "sequenceRationale": "رد یک ساعت در مکالمه به پیشنهاد ساعت تازه می‌رسد، سپس تشخیص معنای توافق و بازسازی پرسش زمان تمرین می‌شود.",
    "templateSignature": "conversation_speaking>multiple_choice>word_order"
  },
  "activities": [
    {
      "id": "act-de-a1-time-review-conversation",
      "type": "conversation_speaking",
      "instructionFa": "یک ساعت نامناسب را رد کن و زمان جایگزین را تأیید کن.",
      "selectionReason": "جفت‌های منبع‌دار ساعت ۱۲ و ۱۹:۴۵، چرخهٔ رد → پیشنهاد → تأیید را کامل می‌کنند.",
      "sourceRefs": [
        "src-wikibooks-de-lesson-021-time-appointment"
      ],
      "learningTargets": [
        "زمان دقیق را مذاکره و تأیید کند."
      ],
      "lexemeRefs": [],
      "dialogueRef": "dlg-de-a1-reschedule-exact-time",
      "data": {
        "interaction": "read_aloud_exchange",
        "openingInitiator": "app"
      },
      "transformations": [
        "other",
        "persian_translation_added",
        "character_metadata_added"
      ],
      "audioStatus": "not_required"
    },
    {
      "id": "act-de-a1-time-review-matching",
      "type": "multiple_choice",
      "instructionFa": "کدام جمله یعنی «این زمان برای من مناسبه»؟",
      "selectionReason": "زبان‌آموز باید پاسخ توافق را از رد زمان تشخیص دهد.",
      "sourceRefs": [
        "src-wikibooks-de-lesson-021-time-appointment"
      ],
      "learningTargets": [
        "تأیید مناسب‌بودن زمان را تشخیص دهد."
      ],
      "lexemeRefs": [],
      "dialogueRef": null,
      "data": {
        "options": [
          {
            "textTarget": "Ja, das passt mir.",
            "translationFa": "بله، برایم مناسب است.",
            "correct": true
          },
          {
            "textTarget": "Es tut mir leid, um 12 Uhr geht es nicht.",
            "translationFa": "متأسفم، ساعت ۱۲ نمی‌شود.",
            "correct": false
          },
          {
            "textTarget": "Morgen geht es vielleicht.",
            "translationFa": "فردا شاید بشود.",
            "correct": false
          }
        ]
      },
      "transformations": [
        "options_selected_from_source_material",
        "persian_translation_added"
      ],
      "audioStatus": "not_required"
    },
    {
      "id": "act-de-a1-time-review-order",
      "type": "word_order",
      "instructionFa": "پرسش قرار ساعت ۱۲ را بساز.",
      "selectionReason": "بازسازی پرسش، الگوی um + ساعت را در یک درخواست واقعی تثبیت می‌کند.",
      "sourceRefs": [
        "src-wikibooks-de-lesson-021-time-appointment"
      ],
      "learningTargets": [
        "پرسش با ساعت دقیق را بازسازی کند."
      ],
      "lexemeRefs": [],
      "dialogueRef": null,
      "data": {
        "sourceText": "Warten Sie um 12 Uhr auf mich?",
        "sourceTextFa": "ساعت ۱۲ منتظر من می‌مانید؟",
        "tokens": [
          "Warten",
          "Sie",
          "um",
          "12",
          "Uhr",
          "auf",
          "mich?"
        ],
        "answer": [
          "Warten",
          "Sie",
          "um",
          "12",
          "Uhr",
          "auf",
          "mich?"
        ]
      },
      "transformations": [
        "sentence_tokenized_for_word_order",
        "persian_translation_added"
      ],
      "audioStatus": "not_required"
    }
  ],
  "status": "final",
  "audioStatus": "pending"
}
